{"admissible":true,"arm_registrations":[{"arm":"vanilla-vllm-entry-points","registration":{"activation_probe_digest":"sha256:7cab385a014cdff5c755e0d6759372d8b4206ad240779d97268abd9434bac54d","commands":[{"command_digest":"sha256:b86336d86f75d930a4270ce29f9863fae235ace3b636c6632d745a1edb2a5832","role":"sut"},{"command_digest":"sha256:9a8d659298af3c6db41246caaf1a6d66126def8db73948af24181005ae7a389d","role":"observer"}],"registry_entry_sha256":"bea295bfb2643929a07ac7ba20236489fc13928cb6f0186b7c3f1477c12cf4ae","registry_id":"h1-910b2-tp2-vanilla-candidate-v1"}},{"arm":"manual-integration","registration":{"activation_probe_digest":"sha256:6f940d84a22bb24a604248c5bd6c84cada65276de429e48c14f22f47eb6a0b40","commands":[{"command_digest":"sha256:1dab15f55033dc91d16363270eb56927fd456d235b9b45333ff4bf2239549583","role":"sut"},{"command_digest":"sha256:9a8d659298af3c6db41246caaf1a6d66126def8db73948af24181005ae7a389d","role":"observer"}],"registry_entry_sha256":"b3f2224b4ea4ba0d0d24ee6ae83fa5ce6fc818d7b96a590ada04fec043dfce48","registry_id":"h1-910b2-tp2-manual-candidate-v1"}},{"arm":"ecpa","registration":{"activation_probe_digest":"sha256:3779cb97de2229fe717790f4bf1a6c5921786cb839242ec1b3c5d64318498f4f","commands":[{"command_digest":"sha256:a0419f178d9f6555217dbafa10a3a0b36cd482282370025d5b6a1bacd58d9d20","role":"manager"},{"command_digest":"sha256:297c9d23ac8ca1220980bc9ca22328fed360689f97dbf38e1424918673e4edc7","role":"target"},{"command_digest":"sha256:9a8d659298af3c6db41246caaf1a6d66126def8db73948af24181005ae7a389d","role":"observer"}],"registry_entry_sha256":"bc7f74f9cbe294ccf712e5a68c40f7b956f4adac47b916b6e738efd3f35bae3d","registry_id":"h1-910b2-tp2-ecpa-candidate-v1"}}],"bindings":{"protocol_sha256":"c76ac785334273d942723cf26fe840a3d7c0cf6cfb15a0fb0aa04810f9ab70bc","registration_design_base":{"commit":"a26ded6b169a25001b03500e7b252740aeabce8b","repository":"intellistream/vllm-hust-ext-manager","tree":"3476f88bc18e295d2e56988ce6af3963d397e5c9"},"study_sha256":"7562631af6b2fce316f8206932c6048e7137e17d7bd601122db82d837c1427cc"},"blockers":[],"deployment_identity":{"accelerator_plugin_commit":"873584026f8a683ac73523f15127569e9f6ab34b","accelerator_plugin_tree":"3a21eb6bec128786be61d3739268b93fda1095ac","container_digest":null,"environment_digest":"sha256:50ad1f54bc29cd29ddd0c4ff27b00e4eb123f4b5710bb547aea533672f51547d","fault_descriptor_sha256":"sha256:83cf593eda175a7a8c809350a6456bb1070bcba25e3b341c9c6598db16d46a17","hardware":"Ascend 910B2","manager_commit":"b734a923a566f3d1b07b22e087fdbab796b3b1d9","manager_tree":"62d3cf4899dff86661a9debb78fa1257cb029775","model":"Qwen/Qwen2.5-7B-Instruct@a09a35458c702b33eeacc393d103063234e8bc28","plugin_entry_point":{"group":"vllm.general_plugins","name":"kv_materialization","value":"vllm_kv_materialization.plugin:register_plugin"},"runtime_commit":"973d9ef5acd2b9beb03e399dec1511a41fc941b5","runtime_tree":"9bc1a9a7dceab8bf1002a5ec5f735e5b454f11af","topology":"single-host TP2 eager","warm_state":"cold","workload_request_sha256":"sha256:9ff24793404386289eb61866b57f6943914af8f46317af28dc60c279e777198d"},"non_claims":["This registration packet is a review input, not runtime authority or a formal-real result.","Only verified-adapters.json authorizes commands at runtime.","Null command and identity slots must not be inferred from developer machines or fixture paths."],"producer_admission_receipt":{"activation_path_reviewed":true,"base":"fc06902b7dd7aa1610438cd061ccf7f04b31c609","commands_reviewed":true,"default_branch":"main","human_line_review":true,"merge_commit":"b326fafe5405b9996db9c9f0d7758536148ecc9b","node_id":"R_kgDOUJjQqg","observed_at":"2026-10-12T20:28:43+08:00","observer_independence_reviewed":true,"pull_request":27,"repository":"vLLM-HUST/vllm-hust","repository_id":1352192170,"reviewed_head":"f3eb4b09ba91a1720c4e35de41a91e6dc351fd5b","reviewed_tree":"bcdb8c810b60c11e77cb8af2002bd9039600b808","schema":"ecpa-formal-adapter-admission/v1","state":"merged"},"producer_candidate":{"base":"fc06902b7dd7aa1610438cd061ccf7f04b31c609","human_line_review":true,"merge_commit":"b326fafe5405b9996db9c9f0d7758536148ecc9b","observed_at":"2026-10-12T20:28:43+08:00","observed_state":"merged","pull_request":27,"repository":"vLLM-HUST/vllm-hust","reviewed_head":"f3eb4b09ba91a1720c4e35de41a91e6dc351fd5b","reviewed_tree":"bcdb8c810b60c11e77cb8af2002bd9039600b808"},"registration_state":"registered","reviews":{"activation_paths":true,"artifact_retention":true,"commands":true,"cross_arm_equivalence":true,"observer_independence":true},"schema":"ecpa-formal-real-deployment-registration/v1","source_registrations":[{"authority":"lifecycle-source","phase":"service-ready","registration":{"command_digest":"sha256:d228a6a701db271d4ba5a65e398002610539d39201edd933ffafd0b0349d5f04","registry_ids":["h1-910b2-tp2-vanilla-candidate-v1","h1-910b2-tp2-manual-candidate-v1","h1-910b2-tp2-ecpa-candidate-v1"]},"source_kind":"readiness-probe","source_subcommand":"readiness-http"},{"authority":"lifecycle-source","phase":"workload-complete","registration":{"command_digest":"sha256:ff92c67a8ccdcede0199590bfb43247399aea4f66d71ca35766894abd51eb3d8","registry_ids":["h1-910b2-tp2-vanilla-candidate-v1","h1-910b2-tp2-manual-candidate-v1","h1-910b2-tp2-ecpa-candidate-v1"]},"source_kind":"workload-driver","source_subcommand":"workload-http"},{"authority":"lifecycle-source","phase":"fault-injected","registration":{"command_digest":"sha256:725e7f84ab2891b1bff4acdc9c2891c28c4028c7e1764b3d5fe8d1045221574f","registry_ids":["h1-910b2-tp2-vanilla-candidate-v1","h1-910b2-tp2-manual-candidate-v1","h1-910b2-tp2-ecpa-candidate-v1"]},"source_kind":"fault-actuator","source_subcommand":"partial-coverage-quarantine"},{"authority":"vllm-hust-host","phase":"observer-captured","registration":{"command_digest":"sha256:6eff86ce46d9b5f1ea88bd43ab51b6d9a17e84398f1526b5450b8eeb346e7814","registry_ids":["h1-910b2-tp2-vanilla-candidate-v1","h1-910b2-tp2-manual-candidate-v1","h1-910b2-tp2-ecpa-candidate-v1"]},"source_kind":"host-observer","source_subcommand":"journal-capture"},{"authority":"process-monitor","phase":"service-shutdown","registration":{"command_digest":"sha256:c8fbccde941c28415349805272ac6079c9e22d12bc563f35ac7df1832ff91f43","registry_ids":["h1-910b2-tp2-vanilla-candidate-v1","h1-910b2-tp2-manual-candidate-v1","h1-910b2-tp2-ecpa-candidate-v1"]},"source_kind":"process-monitor","source_subcommand":"shutdown-process"}],"study_id":"partial-worker-coverage-three-arm-v1"}
